{
  "schemaVersion": 3,
  "featureSets": [
    {
      "id": "FS-200",
      "name": "Private layer downloads"
    }
  ],
  "features": [
    {
      "id": "F-210",
      "featureSetId": "FS-200",
      "name": "Signed download links",
      "lifecycle": "active",
      "lifecycleChange": null
    },
    {
      "id": "F-220",
      "featureSetId": "FS-200",
      "name": "Download access rules",
      "lifecycle": "active",
      "lifecycleChange": null
    }
  ],
  "criticalCoreAreas": [],
  "examples": [],
  "tests": [
    {
      "id": "SST-001",
      "name": "The catalog rejects a test entry that breaks the classification rules, and feature filters return each matching test once.",
      "methodology": "Builds a sample catalog in memory, breaks one classification rule at a time, and checks that validation names that break, including a malformed catalog test identifier and a category prefix that does not match its category. It also checks that a feature filter returns each matching sample once. With synthetic Playwright JSON, it checks that the stored result is the final attempt: a later pass after an earlier failure or inconclusive attempt is passed with a passed-after-retry record, a single pass has no flag, a final failure stays failed, and a final inconclusive attempt stays inconclusive. It does not open the catalog page, require the live catalog to contain zero tests, or run an application test. It checks that a Bug Check requires a nonempty bug reference and root cause analysis on a Feature Behavior Test, and that a baseline test leaves both null.",
      "category": "shared-supporting",
      "owner": null,
      "additionalFeatureAssociations": [],
      "scope": "unit",
      "environment": "non-browser",
      "browserMode": "not-applicable",
      "regression": false,
      "bugReference": null,
      "rootCauseAnalysis": null,
      "enforcement": "nonblocking",
      "enforcementChange": null,
      "durationBudgetMs": 1000,
      "fast": true,
      "sourceFile": "tests/shared/SST-001.test.ts"
    },
    {
      "id": "SST-002",
      "name": "The release check runs the core tests first and stops before feature tests if a core test fails.",
      "methodology": "Calls the same release-gate function the release command uses, with stand-in results. It checks that core runs first and that a failing or inconclusive core result stops the feature phase. It does not run the application or a real failing core test.",
      "category": "shared-supporting",
      "owner": null,
      "additionalFeatureAssociations": [],
      "scope": "unit",
      "environment": "non-browser",
      "browserMode": "not-applicable",
      "regression": false,
      "bugReference": null,
      "rootCauseAnalysis": null,
      "enforcement": "nonblocking",
      "enforcementChange": null,
      "durationBudgetMs": 1000,
      "fast": true,
      "sourceFile": "tests/shared/SST-002.test.ts"
    },
    {
      "id": "FBT-001",
      "name": "Direct bucket address is refused, while a signed-in user's temporary link downloads the national layer file.",
      "methodology": "Proves that a national layer file cannot be opened from its plain bucket address, while a signed-in active user can download it through the temporary link the service returns. File requested: inputs/reference/ramsar/v0.1.0/ramsar.geojson (Ramsar wetlands geometry, listed as national in the download catalog), once through the service and once at its plain storage.googleapis.com address; the DMT_TEST_NATIONAL_OBJECT environment variable can override the key. Signs in a throwaway active account (role user, no SIRAP grant) and calls POST /downloads/signed-url on the deployed Metrics API for that file. It checks a 200 reply with a url, an expires_at between 14 and 16 minutes from now, and Cache-Control: no-store. It then makes a ranged GET for the first 1024 bytes on the returned link and expects 200 or 206 with bytes, and makes an anonymous GET of the same file's plain storage.googleapis.com address and expects 401 or 403. Real: the deployed Metrics API, Firebase Authentication, Firestore, and the Google Cloud Storage (GCS) bucket; nothing in the request path is mocked, and Firebase issues the ID token after a real email-and-password sign-in. Test-only: the Firebase user, created by the Admin SDK with a verified @dmt-test.invalid address so no email is sent, its Firestore users record, and the chosen national object key; the user and record are deleted afterward. Not checked: the web app's download button, server cache timing, 503 configuration errors, or that the link stops working after its 15-minute expiry; 'temporary' is checked only through the reported expires_at time.",
      "category": "feature-behavior",
      "owner": "F-210",
      "additionalFeatureAssociations": [],
      "scope": "integration",
      "environment": "non-browser",
      "browserMode": "not-applicable",
      "regression": false,
      "bugReference": null,
      "rootCauseAnalysis": null,
      "enforcement": "required",
      "enforcementChange": null,
      "durationBudgetMs": 6000,
      "fast": false,
      "sourceFile": "tests/features/FS-200-private-layer-downloads/F-210-signed-download-links/behavior/FBT-001.api.spec.ts"
    },
    {
      "id": "FBT-006",
      "name": "A visitor who is not signed in cannot download a restricted regional file.",
      "methodology": "Proves that a visitor with no sign-in gets no download link for a regional (SIRAP) file and cannot open it from its plain bucket address either. File requested: inputs/reference/orinoquia_savannas/v0.1.0/orinoquia_savannas.metadata.json (Orinoquia savannas metadata, listed as restricted to the orinoquia region), twice through the service and once at its plain storage.googleapis.com address; the DMT_TEST_ORINOQUIA_OBJECT environment variable can override the key. Calls POST /downloads/signed-url on the deployed Metrics API for that file with no Authorization header, then with a made-up bearer string that is not a Firebase ID token, and expects 401 with reason invalid_token each time. No reply body may contain a url, and no raw reply text may contain X-Goog-Signature. It then makes an anonymous GET of the file's plain storage.googleapis.com address and expects 401 or 403. Real: the deployed Metrics API, including its Firebase ID token check, and the Google Cloud Storage (GCS) bucket; nothing in the request path is mocked. Test-only: the made-up token string and the chosen Orinoquia object key; no Firebase account is created. Not checked: expired, revoked, or other-project tokens, signed-in accounts (FBT-003 and FBT-007 cover those), the Eje Cafetero file, the web app's download button, server cache timing, or 503 configuration errors.",
      "category": "feature-behavior",
      "owner": "F-220",
      "additionalFeatureAssociations": [],
      "scope": "integration",
      "environment": "non-browser",
      "browserMode": "not-applicable",
      "regression": false,
      "bugReference": null,
      "rootCauseAnalysis": null,
      "enforcement": "required",
      "enforcementChange": null,
      "durationBudgetMs": 3000,
      "fast": false,
      "sourceFile": "tests/features/FS-200-private-layer-downloads/F-220-download-access-rules/behavior/FBT-006.api.spec.ts"
    },
    {
      "id": "FBT-007",
      "name": "A signed-in user with no regional (SIRAP) access cannot download a restricted regional file.",
      "methodology": "Proves that a signed-in active user who passed the authenticator sign-in but holds no regional (SIRAP) grant gets no download link for a regional file and cannot open it from its plain bucket address either. File requested: inputs/reference/orinoquia_savannas/v0.1.0/orinoquia_savannas.metadata.json (Orinoquia savannas metadata, listed as restricted to the orinoquia region), once through the service and once at its plain storage.googleapis.com address; the DMT_TEST_ORINOQUIA_OBJECT environment variable can override the key. Creates an active account with role user and an empty allowedSirapIds list, enrolls a Time-based One-Time Password (TOTP) authenticator, then signs in again with password plus code, so Firebase marks its ID token's second factor as totp. Asking POST /downloads/signed-url for the file, it expects 403 with reason layer_forbidden; the reply body may not contain a url and the raw reply text may not contain X-Goog-Signature. It then makes an anonymous GET of the file's plain storage.googleapis.com address and expects 401 or 403. Because the authenticator sign-in is present, the refusal isolates the region-grant rule; FBT-003 covers the refusal without an authenticator (mfa_required). Real: the deployed Metrics API, Firebase Authentication including authenticator enrollment and the second-factor sign-in, Firestore, and the Google Cloud Storage (GCS) bucket; nothing in the request path is mocked. Test-only: the Firebase user, created by the Admin SDK with a verified @dmt-test.invalid address so no email is sent, its Firestore users record, authenticator codes computed in memory from the enrollment secret, and the chosen Orinoquia object key; the user and record are deleted afterward. Not checked: a sirap-user granted a different region (FBT-003 covers that with the Eje Cafetero file), the Eje Cafetero file itself, how fast a revoked grant takes effect, the web app's download button, server cache timing, or 503 configuration errors.",
      "category": "feature-behavior",
      "owner": "F-220",
      "additionalFeatureAssociations": [],
      "scope": "integration",
      "environment": "non-browser",
      "browserMode": "not-applicable",
      "regression": false,
      "bugReference": null,
      "rootCauseAnalysis": null,
      "enforcement": "required",
      "enforcementChange": null,
      "durationBudgetMs": 5000,
      "fast": false,
      "sourceFile": "tests/features/FS-200-private-layer-downloads/F-220-download-access-rules/behavior/FBT-007.api.spec.ts"